{
  "id": "prism-launcher",
  "name": "Prism Launcher",
  "status": "platinum",
  "tb": "@hiiragikagami",
  "compatibility": "Works out of the box",
  "notes": "Non-Steam app reported working on Xiaomi Pipa.",
  "platform": "xiaomi-pipa",
  "store": "non-steam",
  "tags": ["launcher", "non-steam"]
}
