{
  "id": "dark-souls-remastered",
  "name": "Dark Souls Remastered",
  "type": "game",
  "status": "platinum",
  "tb": "@corntoller",
  "compatibility": "Works out of the box",
  "notes": "Runs with Proton 11.0 ARM64/LOCAL.",
  "proton": "Proton 11.0 ARM64/LOCAL",
  "platform": "xiaomi-pipa",
  "store": "steam",
  "tags": [
    "out-of-box"
  ]
}
