{
  "id": "boris-and-the-dark-survival",
  "name": "Boris And The Dark Survival",
  "type": "game",
  "status": "borked",
  "tb": "@hiiragikagami",
  "compatibility": "Fails / Borked",
  "notes": "Reported as failure.",
  "proton": "Proton 11.0 ARM64/LOCAL",
  "platform": "xiaomi-pipa",
  "store": "steam",
  "tags": [
    "failure"
  ]
}
