{
  "id": "portal-revolution",
  "name": "Portal Revolution",
  "type": "game",
  "status": "platinum",
  "tb": "@neo10e",
  "compatibility": "Works out of the box",
  "notes": "Runs with Proton 11.0 ARM64/LOCAL.",
  "proton": "Proton 11.0 ARM64/LOCAL",
  "platform": "xiaomi-pipa",
  "store": "steam",
  "tags": [
    "puzzle",
    "out-of-box"
  ]
}
