{
  "id": "bendy-and-the-dark-revival",
  "name": "Bendy And The Dark Revival",
  "status": "platinum",
  "tb": "@hiiragikagami",
  "compatibility": "Works out of the box",
  "notes": "If prompted to force quit, press wait.",
  "proton": "Proton 11.0 ARM64/LOCAL",
  "platform": "xiaomi-pipa",
  "store": "steam",
  "tags": ["out-of-box"]
}
