{
  "id": "hollow-knight-silksong",
  "name": "Hollow Knight: Silksong",
  "status": "platinum",
  "tb": "@hiiragikagami",
  "compatibility": "Works out of the box",
  "notes": "Listed as working by tester report.",
  "proton": "Proton 11.0 ARM64/LOCAL",
  "platform": "xiaomi-pipa",
  "store": "steam",
  "tags": ["metroidvania", "out-of-box"]
}
